{
  "capacity_fit_status": "PASS",
  "differentiation_fit_status": "PASS",
  "editability_fit_status": "PASS",
  "layout_ids": [
    "layout-decision-hero",
    "layout-process-flow",
    "layout-risk-evidence-grid",
    "layout-options-matrix",
    "layout-recommendation-focus",
    "layout-roadmap-sources"
  ],
  "layout_repetition_violation_count": 0,
  "module_differentiation_status": "PASS",
  "report_hash": "2dd3a55706cce8e8493a210cbf0290560a0588ceaadbb33991711db5442663ff",
  "report_id": "geometryfit_05a689812c65c5b22ebd",
  "schema_name": "phase4_geometry_fit_report",
  "schema_version": "1.0.0",
  "semantic_fit_status": "PASS",
  "slide_count": 6,
  "slides": [
    {
      "capacity_fit": "PASS",
      "differentiation_fit": "PASS",
      "editability_fit": "PASS",
      "expected_target_relation": true,
      "full_slide_raster_slot_count": 0,
      "native_raster_overlap_count": 0,
      "semantic_fit": "PASS",
      "sidecar_id": "sidecar_0ce9385de2639ae70f78",
      "sidecar_slide_relation": true,
      "slide_id": "slide-01-decision-framing",
      "status": "PASS",
      "visual_target_id": "visualtarget_c917f32532dfa26b4560"
    },
    {
      "capacity_fit": "PASS",
      "differentiation_fit": "PASS",
      "editability_fit": "PASS",
      "expected_target_relation": true,
      "full_slide_raster_slot_count": 0,
      "native_raster_overlap_count": 0,
      "semantic_fit": "PASS",
      "sidecar_id": "sidecar_5d20f321f92a4fd268ac",
      "sidecar_slide_relation": true,
      "slide_id": "slide-02-system-process",
      "status": "PASS",
      "visual_target_id": "visualtarget_eb8bc3132476d2929014"
    },
    {
      "capacity_fit": "PASS",
      "differentiation_fit": "PASS",
      "editability_fit": "PASS",
      "expected_target_relation": true,
      "full_slide_raster_slot_count": 0,
      "native_raster_overlap_count": 0,
      "semantic_fit": "PASS",
      "sidecar_id": "sidecar_64ca44f39ae7dbd432e3",
      "sidecar_slide_relation": true,
      "slide_id": "slide-03-risk-findings",
      "status": "PASS",
      "visual_target_id": "visualtarget_04b7463dd0285b07a31a"
    },
    {
      "capacity_fit": "PASS",
      "differentiation_fit": "PASS",
      "editability_fit": "PASS",
      "expected_target_relation": true,
      "full_slide_raster_slot_count": 0,
      "native_raster_overlap_count": 0,
      "semantic_fit": "PASS",
      "sidecar_id": "sidecar_669adc2c4ebcb89c3d6c",
      "sidecar_slide_relation": true,
      "slide_id": "slide-04-options-comparison",
      "status": "PASS",
      "visual_target_id": "visualtarget_83244783582673b6aa13"
    },
    {
      "capacity_fit": "PASS",
      "differentiation_fit": "PASS",
      "editability_fit": "PASS",
      "expected_target_relation": true,
      "full_slide_raster_slot_count": 0,
      "native_raster_overlap_count": 0,
      "semantic_fit": "PASS",
      "sidecar_id": "sidecar_3259b4d651ab52adc2b3",
      "sidecar_slide_relation": true,
      "slide_id": "slide-05-recommendation",
      "status": "PASS",
      "visual_target_id": "visualtarget_8a7c9dbcfafcedbe2b2c"
    },
    {
      "capacity_fit": "PASS",
      "differentiation_fit": "PASS",
      "editability_fit": "PASS",
      "expected_target_relation": true,
      "full_slide_raster_slot_count": 0,
      "native_raster_overlap_count": 0,
      "semantic_fit": "PASS",
      "sidecar_id": "sidecar_365e3284fc3e8132e688",
      "sidecar_slide_relation": true,
      "slide_id": "slide-06-implementation-sources",
      "status": "PASS",
      "visual_target_id": "visualtarget_1b24176472703beee735"
    }
  ],
  "status": "PASS",
  "unique_layout_count": 6
}
